{
  "$schema": "https://json-schema.org/draft/2020-12/schema",
  "$id": "https://github.com/BlissDirective/Gigantic-Journeys/data/schemas/avatar/consent_record.schema.json",
  "title": "Gigantic Journeys consent record",
  "description": "One immutable, per-purpose opt-in/withdrawal record for the layered custom-avatar consent (AUTH #044; SECURITY_CHECKLIST §5.1; legal/BIPA_CONSENT.md §4). Proof of consent — it carries NO image and NO raw biometric. A `granted:false` record is a withdrawal. No action in a purpose is permitted without a matching `granted:true` record.",
  "type": "object",
  "additionalProperties": false,
  "required": ["schema_version", "user_id", "purpose", "granted", "policy_version", "consent_text_hash", "timestamp", "locale", "app_version"],
  "properties": {
    "schema_version": { "const": "1.0.0" },
    "user_id": {
      "type": "string",
      "description": "Pseudonymous auth uid — never a name, email, or device id.",
      "pattern": "^[A-Za-z0-9_-]{1,64}$"
    },
    "purpose": {
      "description": "The specific, unbundled purpose this record consents to (or withdraws).",
      "enum": ["custom_avatar_biometric", "avatar_cloud_sync", "share_highlight", "share_summit", "share_competition", "training"]
    },
    "granted": { "type": "boolean" },
    "policy_version": {
      "description": "Consent-copy version; a new version re-prompts and writes a new record (§5.5).",
      "type": "string",
      "pattern": "^[a-z0-9.-]{1,40}$"
    },
    "consent_text_hash": {
      "description": "sha256 of the exact on-screen consent statement, so we can prove what was shown.",
      "type": "string",
      "pattern": "^[a-f0-9]{64}$"
    },
    "timestamp": {
      "type": "string",
      "pattern": "^[0-9]{4}-[0-9]{2}-[0-9]{2}T[0-9]{2}:[0-9]{2}:[0-9]{2}(\\.[0-9]+)?Z$"
    },
    "locale": { "type": "string", "pattern": "^[a-z]{2}(-[A-Z]{2})?$" },
    "app_version": { "type": "string", "pattern": "^[0-9A-Za-z.+-]{1,40}$" }
  }
}
